<?xml version="1.0" encoding="UTF-8"?>
<!-- Copyright (2008) Schibsted ASA
 *   This file is part of SESAT.
 *
 *   SESAT is free software: you can redistribute it and/or modify
 *   it under the terms of the GNU Affero General Public License as published by
 *   the Free Software Foundation, either version 3 of the License, or
 *   (at your option) any later version.
 *
 *   SESAT is distributed in the hope that it will be useful,
 *   but WITHOUT ANY WARRANTY; without even the implied warranty of
 *   MERCHANTABILITY or FITNESS FOR A PARTICULAR PURPOSE.  See the
 *   GNU Affero General Public License for more details.
 *
 *   You should have received a copy of the GNU Affero General Public License
 *   along with SESAT.  If not, see <http://www.gnu.org/licenses/>.
 *
    Document   : views.xml
    Created on : 4 April 2006, 16:25
    Author     : mick
    Description:
        Purpose of the document follows. -->

<views xmlns:xsi="http://www.w3.org/2001/XMLSchema-instance" xsi:noNamespaceSchemaLocation="../../../../../../views.xsd">
    <!-- Override default to show its css -->
    <tab id="default" display-css="true" inherit="default"/>
    <!-- Our base sesam.com view -->
    <tab id="default-sesam-com" inherit="default"/>
    <!-- The one vertical we have. -->
    <tab id="international" inherit="default-sesam-com"
            key="g"
            mode="international" 
            page-size="10"
            rss-result-name="globalSearch">
        <navigation>
            <navigation id="offset">
              <result-paging id="offset" command-name="globalSearch" page-size="10" number-of-pages="10" hitcount-source="totalhits"/>
            </navigation>
        </navigation>
        <layout main="sesam.com/main.jsp" front="sesam.com/index.jsp">
            <include key="head-element" template="sesam.com/head.jsp"/>
            <include key="head-element-extra" template="sesam.com/mwsuggest.jsp"/>
            <include key="top-col-one" template="sesam.com/searchbar-top.jsp"/>
            <include key="main-col-three" template="sesam.com/globalSearch.jsp"/>
            <include key="bottom-col-one" template="sesam.com/offsetPager.jsp"/>
            <include key="bottom-col-three" template="sesam.com/footer.jsp"/>
            <include key="bottom-col-two" template="sesam.com/searchbar-bottom.jsp"/>
            <include key="offsetPagerLogo" template=""/>          
            <include key="no-hits" template="sesam.com/no-hits.jsp"/>   
        </layout>
    </tab>
</views>

